diario,titulo,contenido,fecha de extracción,contenido_depurado
www.ambito.com,"Quién es Robert Kiyosaki, el piloto de guerra que se convirtió en el mayor gurú financiero de la historia",<p>Kiyosaki es un millonario hecho a sí mismo y atribuye gran parte de su éxito a su comprensión de los conceptos financieros y las estrategias de inversión.</p>,"Tue, 14 May 2024 15:00:00 -0300",Kiyosaki es un millonario hecho a sí mismo y atribuye gran parte de su éxito a su comprensión de los conceptos financieros y las estrategias de inversión.
www.ambito.com,Hot Sale 2024: bancos y billeteras virtuales ofrecen descuentos de hasta 70% y cuotas sin interés,"<p>La décima edición de este evento, que impulsa la Cámara Argentina de Comercio Electrónico (CACE), contará con múltiples ofertas y cuotas sin interés por parte de bancos y billeteras virtuales, los cuales detallamos a continuación.</p>","Tue, 14 May 2024 13:26:00 -0300","La décima edición de este evento, que impulsa la Cámara Argentina de Comercio Electrónico (CACE), contará con múltiples ofertas y cuotas sin interés por parte de bancos y billeteras virtuales, los cuales detallamos a continuación."
www.ambito.com,Cinco pasos para aprovechar la potencia de la IA en servicios de atención al cliente,"<p>Anticipo de la conferencia que realizaré el 30 de mayo en el CEM, Buenos Aires.</p>","Tue, 14 May 2024 10:39:34 -0300","Anticipo de la conferencia que realizaré el 30 de mayo en el CEM, Buenos Aires."
www.ambito.com,Revelan que Santander sufrió una filtración masiva de datos de sus clientes y empleados,"<p>Según trascendió hasta ahora, los afectados son clientes y empleados en España, Uruguay y Chile. Se desconoce si otros países, como la Argentina donde Santander tiene una de las carteras más grandes, resultaron afectados. </p>","Tue, 14 May 2024 10:10:35 -0300","Según trascendió hasta ahora, los afectados son clientes y empleados en España, Uruguay y Chile. Se desconoce si otros países, como la Argentina donde Santander tiene una de las carteras más grandes, resultaron afectados."
www.ambito.com,"Quién es Susanne Klatten, la mujer más rica de Alemania y cómo logró su fortuna","<p data-sider-select-id=""d41a6414-40c7-40a9-af18-0044a783a03f"">Ella y su hermano Stefan Quandt son herederos de la estirpe empresarial más poderosa del país y llegaron a estar dentro del top 3 de los más ricos del mundo.</p>","Tue, 14 May 2024 07:30:00 -0300",Ella y su hermano Stefan Quandt son herederos de la estirpe empresarial más poderosa del país y llegaron a estar dentro del top 3 de los más ricos del mundo.
www.ambito.com,El oro reafirma su tendencia alcista: ¿conviene invertir en el metal?,<p>Las claves para invertir en oro durante el mes de mayo.</p>,"Tue, 14 May 2024 00:00:00 -0300",Las claves para invertir en oro durante el mes de mayo.
www.ambito.com,Inflación vs rentabilidad: la inversión ganadora que eligen cada vez más argentinos,"<p>Tras la baja de las tasas de interés, la tendencia desafía a los ahorristas a encontrar nuevas formas de obtener rentabilidades consistentes y previsibles. Con el horizonte en el mediano plazo, cuáles activos logran capitalizar y aumentar el patrimonio.</p>","Tue, 14 May 2024 00:00:00 -0300","Tras la baja de las tasas de interés, la tendencia desafía a los ahorristas a encontrar nuevas formas de obtener rentabilidades consistentes y previsibles. Con el horizonte en el mediano plazo, cuáles activos logran capitalizar y aumentar el patrimonio."
www.ambito.com,Bitso anunció el lanzamiento de su Web3 Wallet y abre la puerta a la nueva era de internet,"<p><span class=""ignore-parser"">La Bitso Web3 Wallet vuelve más sencillo el ingreso a la Web3 y permite acceder a más de 2.000 tokens, conectarse con cientos de dApps y coleccionar NFTs desde la misma app. </span><span class=""ignore-parser"">Se calcula que el valor de mercado global de la Web3 alcanzará los 6.630 millones de dólares en 2024.</span></p>","Mon, 13 May 2024 20:30:50 -0300","La Bitso Web3 Wallet vuelve más sencillo el ingreso a la Web3 y permite acceder a más de 2.000 tokens, conectarse con cientos de dApps y coleccionar NFTs desde la misma app.Se calcula que el valor de mercado global de la Web3 alcanzará los 6.630 millones de dólares en 2024."
www.ambito.com,El Banco Nación lanzó créditos para ayudar a productores afectados por la chicharrita,"<p>Se trata de créditos destinados a Inversión Productiva, con tasa fija del 26%, los primeros 3 años y para capital de trabajo, a una TNA desde el 33% y sin tope máximo para palear los desastres que causó la plaga que hizo caer la proyección de cosecha del maíz.</p>","Mon, 13 May 2024 19:53:00 -0300","Se trata de créditos destinados a Inversión Productiva, con tasa fija del 26%, los primeros 3 años y para capital de trabajo, a una TNA desde el 33% y sin tope máximo para palear los desastres que causó la plaga que hizo caer la proyección de cosecha del maíz."
www.ambito.com,Hot Sale: revelan cuáles son los productos más buscados y cuánto es el descuento promedio,<p>El festival de descuentos digitales arrancó este lunes y se estirará hasta el miércoles de esta semana.</p>,"Mon, 13 May 2024 18:00:00 -0300",El festival de descuentos digitales arrancó este lunes y se estirará hasta el miércoles de esta semana.
www.ambito.com,"Quién es Rinat Akhmetov, el multimillonario más rico de Ucrania que vive en un refugio secreto por la guerra",<p>Es uno de los millonarios que más perdió por el enfrentamiento contra Rusia. Los perjuicios hacia sus compañías ascienden hasta los 10 mil millones de dólares.</p>,"Mon, 13 May 2024 17:30:00 -0300",Es uno de los millonarios que más perdió por el enfrentamiento contra Rusia. Los perjuicios hacia sus compañías ascienden hasta los 10 mil millones de dólares.
www.ambito.com,Melinda Gates abandona la fundación filantrópica creada con Bill Gates,"<p>""Después de reflexión y pensarlo cuidadosamente, decidí renunciar a mi rol de copresidente de la Fundación Bill &amp; Melinda Gates"", escribió en un comunicado divulgado en redes sociales.</p>","Mon, 13 May 2024 14:29:00 -0300","""Después de reflexión y pensarlo cuidadosamente, decidí renunciar a mi rol de copresidente de la Fundación Bill & Melinda Gates"", escribió en un comunicado divulgado en redes sociales."
www.ambito.com,Fate despedirá casi 100 trabajadores por la caída de las ventas,"<p>El fabricante de neumáticos Fate anunció un ""ajuste de su estructura"" a raíz de la ""pérdida de competitividad exportadora"" y la ""caída de demanda del mercado interno"".</p>","Mon, 13 May 2024 13:23:12 -0300","El fabricante de neumáticos Fate anunció un ""ajuste de su estructura"" a raíz de la ""pérdida de competitividad exportadora"" y la ""caída de demanda del mercado interno""."
www.ambito.com,"Quién es Jensen Huang, el taiwanés que pasó de laver a platos a ser la 20° persona más rica del mundo",<p>El CEO de Nvidia es uno de los mayores millonarios del mundo tras la revolución que está generando la Inteligencia Artificial.</p>,"Mon, 13 May 2024 13:06:00 -0300",El CEO de Nvidia es uno de los mayores millonarios del mundo tras la revolución que está generando la Inteligencia Artificial.
www.ambito.com,Para el 33% de los argentinos el trabajo remoto es algo innegociable,"<p>Así lo reveló una encuesta de la consultora Randstad, que reflejó las expectativas, estados de ánimo y comportamiento de los trabajadores en 34 países, incluido la Argentina.</p>","Mon, 13 May 2024 13:04:31 -0300","Así lo reveló una encuesta de la consultora Randstad, que reflejó las expectativas, estados de ánimo y comportamiento de los trabajadores en 34 países, incluido la Argentina."
www.ambito.com,Booking entró en la lista de empresas bajo vigilancia reforzada de la UE,"<p>La lista a la que ahora se suma Booking ya incluye a gigantes como Alphabet (Google), Amazon, Apple, Meta (Facebook e Instagram), Microsoft y ByteDance (TikTok).</p>","Mon, 13 May 2024 08:55:47 -0300","La lista a la que ahora se suma Booking ya incluye a gigantes como Alphabet (Google), Amazon, Apple, Meta (Facebook e Instagram), Microsoft y ByteDance (TikTok)."
www.ambito.com,Los idiomas y la dimensión cultural como factores de éxito en los vínculos comerciales,"<p>Diálogo con Florencia Pesce, Directora Académica del Centro Universitario de Idiomas (CUI).</p>","Mon, 13 May 2024 00:00:00 -0300","Diálogo con Florencia Pesce, Directora Académica del Centro Universitario de Idiomas (CUI)."
www.ambito.com,"Hot Sale: qué ofertas, descuentos y cuotas ofrecerán las marcas","<p>En esta oportunidad participarán casi 1.000 marcas. Como viene ocurriendo en los últimos años, se espera que muchos usuarios hagan compras cotidianas para stockearse de productos y tratar de darle pelea a la inflación, o adquirir bienes que vienen postergando a la espera de ofertas o financiación.</p>","Sun, 12 May 2024 16:38:00 -0300","En esta oportunidad participarán casi 1.000 marcas. Como viene ocurriendo en los últimos años, se espera que muchos usuarios hagan compras cotidianas para stockearse de productos y tratar de darle pelea a la inflación, o adquirir bienes que vienen postergando a la espera de ofertas o financiación."
www.ambito.com,"Quién es María Fernanda Amorim, la multimillonaria más poderosa de Portugal gracias a los corchos","<p>Viuda del empresario Américo Amorim, cuenta con una fortuna de 4300 millones de euros, producto de la mayor empresa de corchos a nivel mundial.</p>","Sun, 12 May 2024 16:30:00 -0300","Viuda del empresario Américo Amorim, cuenta con una fortuna de 4300 millones de euros, producto de la mayor empresa de corchos a nivel mundial."
www.ambito.com,"Quién es Timothy Dexter, el multimillonario con más suerte de toda la historia que fingió su muerte",<p>Conocé la increíble historia de este extravagante millonario estadounidense del siglo XIII.</p>,"Sun, 12 May 2024 14:00:00 -0300",Conocé la increíble historia de este extravagante millonario estadounidense del siglo XIII.
www.perfil.com,Canasta Básica: las familias necesitaron más de $800.000 para no ser pobres en abril,"<p><img src=""https://fotos.perfil.com/2024/03/13/trim/540/304/inflacion-1769715.jpg"" alt=""Inflación"" /></p>Mientras la Canasta Básica Alimentaria (CBA) aumentó un 4,2%, la Canasta Básica Total (CBT) subió un 7,1%. Ambos indicadores, por debajo de la inflación y con los niveles más bajos en la era Milei.
 <a href=""https://www.perfil.com/noticias/economia/canasta-basica-total-alimentaria-abril-inflacion-indec.phtml"">Leer más</a>","Tue, 14 May 2024 19:09:00 GMT","Mientras la Canasta Básica Alimentaria (CBA) aumentó un 4,2%, la Canasta Básica Total (CBT) subió un 7,1%. Ambos indicadores, por debajo de la inflación y con los niveles más bajos en la era Milei.Leer más"
www.perfil.com,"La inflación de abril fue de 8,8% en abril y acumula 289,4% interanual","<p><img src=""https://fotos.perfil.com/2024/04/18/trim/540/304/inflacion-y-precios-1787509.jpg"" alt=""Inflación y precios"" /></p>Se trata del primer índice de un dígito en la presidencia de Javier Milei, de acuerdo con lo proyectado por las consultoras privadas.  <a href=""https://www.perfil.com/noticias/economia/el-indec-publica-la-inflacion-de-abril-y-seria-la-primera-vez-que-llega-a-un-digito-en-el-gobierno-de-milei.phtml"">Leer más</a>","Tue, 14 May 2024 19:01:00 GMT","Se trata del primer índice de un dígito en la presidencia de Javier Milei, de acuerdo con lo proyectado por las consultoras privadas.Leer más"
www.perfil.com,"A cuánto cerró el real blue hoy, martes 14 de mayo de 2024","<p><img src=""https://fotos.perfil.com/2024/01/08/trim/540/304/real-brasil-1733478.jpg"" alt=""Real Brasil"" /></p>Conoce los valores de cierre de la divisa brasilera, hoy 14 de mayo de 2024.
 <a href=""https://www.perfil.com/noticias/economia/a-cuanto-cerro-el-real-blue-hoy-martes-14-de-mayo-de-2024.phtml"">Leer más</a>","Tue, 14 May 2024 18:46:47 GMT","Conoce los valores de cierre de la divisa brasilera, hoy 14 de mayo de 2024.Leer más"
www.perfil.com,El euro blue cerró a $1120 para la compra y $1152 para la venta este martes 14 de mayo de 2024,"<p><img src=""https://fotos.perfil.com/2022/09/20/trim/540/304/euros-1423652.jpg"" alt=""Euros"" /></p>Conoce los valores de cierre de la divisa europea, hoy 14 de mayo de 2024.
 <a href=""https://www.perfil.com/noticias/economia/el-euro-blue-cerro-a-1120-para-la-compra-y-1152-para-la-venta-este-martes-14-de-mayo-de-2024.phtml"">Leer más</a>","Tue, 14 May 2024 18:46:17 GMT","Conoce los valores de cierre de la divisa europea, hoy 14 de mayo de 2024.Leer más"
www.perfil.com,El dólar blue cerró a $1045 para la compra y $1065 para la venta este martes 14 de mayo de 2024,"<p><img src=""https://fotos.perfil.com/2024/03/27/trim/540/304/el-dolar-blue-vuelve-a-arrancar-la-jornada-a-la-baja-este-27-de-marzo-1777217.jpg"" alt=""El dólar blue vuelve a arrancar la jornada a la baja este 27 de marzo"" /></p>Conoce los valores de cierre de la divisa norteamericana, hoy 14 de mayo de 2024.
 <a href=""https://www.perfil.com/noticias/economia/el-dolar-blue-cerro-a-1045-para-la-compra-y-1065-para-la-venta-este-martes-14-de-mayo-de-2024.phtml"">Leer más</a>","Tue, 14 May 2024 18:45:42 GMT","Conoce los valores de cierre de la divisa norteamericana, hoy 14 de mayo de 2024.Leer más"
www.perfil.com,Encuesta: la desocupación ya empata a la inflación como el principal problema,"<p><img src=""https://fotos.perfil.com/2024/05/14/trim/540/304/marcha-de-trabajadores-estatales-1801545.jpg"" alt=""Marcha de trabajadores estatales"" /></p>Con el índice IPC en caída, la recesión y su efecto en la merma de puesto de trabajo crecen entre las alarmas económicas según datos de Opina Argentina. <a href=""https://noticias.perfil.com/noticias/informacion-general/encuesta-la-desocupacion-ya-empata-a-la-inflacion-como-el-principal-problema.phtml"">Leer más</a>","Tue, 14 May 2024 18:39:47 GMT","Con el índice IPC en caída, la recesión y su efecto en la merma de puesto de trabajo crecen entre las alarmas económicas según datos de Opina Argentina.Leer más"
www.perfil.com,"Qué es el RIGI, el capítulo de la Ley Bases que busca atraer grandes inversiones","<p><img src=""https://fotos.perfil.com/2024/03/14/trim/540/304/senado-el-dnu-7023-fue-rechazado-por-42-votos-contra-25-1770784.jpg"" alt=""Senado: el DNU 70/23 fue rechazado por 42 votos contra 25."" /></p>Uno de los aspectos claves del proyecto que cuenta con media sanción en Diputados, es el nuevo marco legal de incentivos impositivos, aduaneros y cambiarios para atraer inversiones. <a href=""https://www.perfil.com/noticias/economia/que-es-el-rigi-el-capitulo-de-la-ley-bases-que-busca-atraer-grandes-inversiones.phtml"">Leer más</a>","Tue, 14 May 2024 18:08:00 GMT","Uno de los aspectos claves del proyecto que cuenta con media sanción en Diputados, es el nuevo marco legal de incentivos impositivos, aduaneros y cambiarios para atraer inversiones.Leer más"
www.perfil.com,Impacto de la crisis: la salud mental en juego,"<p><img src=""https://fotos.perfil.com/2024/05/14/trim/540/304/depresion-1801510.jpeg"" alt=""Depresión"" /></p>Las consecuencias de la recesión y la incertidumbre tienen efectos palpables también sobre la salud mental de los argentinos. Un llamado a la acción. <a href=""https://noticias.perfil.com/noticias/economia/la-salud-mental-en-juego.phtml"">Leer más</a>","Tue, 14 May 2024 18:00:28 GMT",Las consecuencias de la recesión y la incertidumbre tienen efectos palpables también sobre la salud mental de los argentinos. Un llamado a la acción.Leer más
www.perfil.com,"Dólar hoy y dólar blue hoy, en VIVO: el minuto a minuto de la cotización de este martes 14 de mayo de 2024","<p><img src=""https://fotos.perfil.com/2024/02/21/trim/540/304/mariano-gorodisch-sobre-la-baja-del-dolar-todo-parece-indicar-que-esta-tendencia-va-a-continuar-1758866.jpg"" alt=""Mariano Gorodisch sobre la baja del dólar: “Todo parece indicar que esta tendencia va a continuar”"" /></p>Seguí en vivo la cotización del dólar oficial, MEP, CCL, Cripto y Blue. Cuál es el valor en el mercado de la divisa norteamericana hoy, 14 de mayo de 2024.
 <a href=""https://www.perfil.com/noticias/economia/dolar-hoy-y-dolar-blue-hoy-en-vivo-el-minuto-a-minuto-de-la-cotizacion-de-este-martes-14-de-mayo-de-2024.phtml"">Leer más</a>","Tue, 14 May 2024 16:21:00 GMT","Seguí en vivo la cotización del dólar oficial, MEP, CCL, Cripto y Blue. Cuál es el valor en el mercado de la divisa norteamericana hoy, 14 de mayo de 2024.Leer más"
www.perfil.com,Euro blue hoy: el minuto a minuto de la cotización de este martes 14 de mayo de 2024,"<p><img src=""https://fotos.perfil.com/2022/07/05/trim/540/304/euros-20220705-1381728.jpg"" alt=""Euros 20220705"" /></p>Seguí en vivo la apertura del mercado de la divisa europea hoy, 14 de mayo de 2024.
 <a href=""https://www.perfil.com/noticias/economia/euro-blue-hoy-el-minuto-a-minuto-de-la-cotizacion-de-este-martes-14-de-mayo-de-2024.phtml"">Leer más</a>","Tue, 14 May 2024 16:11:00 GMT","Seguí en vivo la apertura del mercado de la divisa europea hoy, 14 de mayo de 2024.Leer más"
www.perfil.com,"A cuánto cotiza el real blue hoy, martes 14 de mayo de 2024","<p><img src=""https://fotos.perfil.com/2024/01/16/trim/540/304/real-brasil-1738326.jpg"" alt=""Real Brasil"" /></p>Seguí en vivo la apertura del mercado de la divisa brasilera hoy, martes 14 de mayo de 2024.
 <a href=""https://www.perfil.com/noticias/economia/a-cuanto-cotiza-el-real-blue-hoy-martes-14-de-mayo-de-2024.phtml"">Leer más</a>","Tue, 14 May 2024 16:01:00 GMT","Seguí en vivo la apertura del mercado de la divisa brasilera hoy, martes 14 de mayo de 2024.Leer más"
www.perfil.com,"Ricardo Delgado: ""En el segundo semestre se va a poner a prueba el plan económico""","<p><img src=""https://fotos.perfil.com/2024/05/14/trim/540/304/ricardo-delgado-1801261.jpg"" alt=""Ricardo Delgado"" /></p>El economista sostuvo que el problema más difícil que enfrenta Milei es el de ""romper la inercia"" y perforar el 5% o 6% de inflación mensual. ""Estamos con caídas de la actividad que no se veían desde el 2001"", advirtió.  <a href=""https://www.perfil.com/noticias/modo-fontevecchia/ricardo-delgado-en-el-segundo-semestre-se-va-a-poner-a-prueba-el-plan-economico-modof.phtml"">Leer más</a>","Tue, 14 May 2024 15:10:49 GMT","El economista sostuvo que el problema más difícil que enfrenta Milei es el de ""romper la inercia"" y perforar el 5% o 6% de inflación mensual. ""Estamos con caídas de la actividad que no se veían desde el 2001"", advirtió.Leer más"
www.perfil.com,Panorama de Noticias en Radio Perfil,"<p><img src=""https://fotos.perfil.com/2024/01/22/trim/540/304/panorama-de-noticias-en-radio-perfil-1742091.jpg"" alt=""Panorama de Noticias en Radio Perfil"" /></p>Noticias todo el tiempo, sin perder tu tiempo.  <a href=""https://radio.perfil.com/en-vivo/radio"">Leer más</a>","Tue, 14 May 2024 15:00:00 GMT","Noticias todo el tiempo, sin perder tu tiempo.Leer más"
www.perfil.com,Mercado interno y exportación: los puntos claves de la Ley Bases que modificarán el régimen de los hidrocarburos,"<p><img src=""https://fotos.perfil.com/2024/05/14/trim/540/304/hidrocarburos-1801383.jpg"" alt=""Hidrocarburos"" /></p>“El proyecto de ley reforma de manera bastante estructural el actual régimen de los hidrocarburos”, explicó el titular de la consultora PASPARTÚ, Juan José Carbajales. <a href=""https://www.perfil.com/noticias/canal-e/mercado-interno-y-exportacion-los-puntos-claves-de-la-ley-bases-en-cuanto-al-regimen-de-los-hidrocarburos.phtml"">Leer más</a>","Tue, 14 May 2024 14:56:37 GMT","“El proyecto de ley reforma de manera bastante estructural el actual régimen de los hidrocarburos”, explicó el titular de la consultora PASPARTÚ, Juan José Carbajales.Leer más"
www.perfil.com,Boom del litio: cuáles son los perfiles profesionales que buscan los inversores,"<p><img src=""https://fotos.perfil.com/2024/05/14/trim/540/304/a-partir-del-boom-del-litio-hay-nuevos-puestos-laborales-que-se-buscan-en-torno-a-la-mineria-1801380.jpg"" alt=""A partir del boom del litio, hay nuevos puestos laborales que se buscan en torno a la minería."" /></p>Según expertos, éste sector solicita por empezar ingenieros industriales, electromecánicos e ingenieros químicos. <a href=""https://www.perfil.com/noticias/reperfilar/boom-del-litio-cuales-son-los-perfiles-profesionales-que-buscan-los-inversores.phtml"">Leer más</a>","Tue, 14 May 2024 14:54:45 GMT","Según expertos, éste sector solicita por empezar ingenieros industriales, electromecánicos e ingenieros químicos.Leer más"
www.perfil.com,Camioneros del norte de Chile protestan por el aumento de la inseguridad,"<p><img src=""https://fotos.perfil.com/2024/05/13/trim/540/304/BC-camioneros-del-norte-de-chile-protestan-por-aumento-de-la-inseguridad-cP.jpg"" alt=""There's Not Enough Water In Chile To Support The Population "" /></p>Conductores de pequeñas y medianas empresas de transporte bloquearon las carreteras ante el aumento en los índices de asesinatos. Reclaman controles fronterizos, puntos de control vial y el despliegue de personal militar. <a href=""https://www.perfil.com/noticias/bloomberg/bc-camioneros-del-norte-de-chile-protestan-por-aumento-de-la-inseguridad.phtml"">Leer más</a>","Tue, 14 May 2024 14:47:00 GMT","Conductores de pequeñas y medianas empresas de transporte bloquearon las carreteras ante el aumento en los índices de asesinatos. Reclaman controles fronterizos, puntos de control vial y el despliegue de personal militar.Leer más"
www.perfil.com,El nuevo dueño de la minera peruana Volcan planteó un refinanciamiento de su deuda,"<p><img src=""https://fotos.perfil.com/2024/05/13/trim/540/304/BC-peruana-volcan-evitara-recorte-de-deuda-dice-nuevo-propietario-xg.jpg"" alt=""Volcan Cia. Minera SAA's Cerro de Pasco Mine"" /></p>José Luis Manzano, nuevo accionista mayoritario de la compañía, desestimó los rumores sobre incumplimientos de la minera de zinc. <a href=""https://www.perfil.com/noticias/bloomberg/bc-peruana-volcan-evitara-recorte-de-deuda-dice-nuevo-propietario.phtml"">Leer más</a>","Tue, 14 May 2024 14:45:00 GMT","José Luis Manzano, nuevo accionista mayoritario de la compañía, desestimó los rumores sobre incumplimientos de la minera de zinc.Leer más"
www.perfil.com,Cuáles son los cambios en el Impuesto PAIS ,"<p><img src=""https://fotos.perfil.com/2024/05/14/trim/540/304/el-ministerio-de-economia-anuncio-una-modificacion-en-el-impuesto-para-una-argentina-inclusiva-1801374.jpg"" alt=""El Ministerio de Economía anunció una modificación en el Impuesto Para una Argentina Inclusiva."" /></p>El Ministerio de Economía anunció una modificación en el Impuesto Para una Argentina Inclusiva y alcanza a la compra de billetes y divisas en moneda extranjera para la distribución de utilidades y dividendos. <a href=""https://www.perfil.com/noticias/reperfilar/impuesto-pais-cuales-son-los-cambios.phtml"">Leer más</a>","Tue, 14 May 2024 14:43:53 GMT",El Ministerio de Economía anunció una modificación en el Impuesto Para una Argentina Inclusiva y alcanza a la compra de billetes y divisas en moneda extranjera para la distribución de utilidades y dividendos.Leer más
www.perfil.com,“El Gobierno ya quiere poner en marcha el debate de un nuevo acuerdo con el Fondo Monetario Internacional”,"<p><img src=""https://fotos.perfil.com/2024/05/14/trim/540/304/caputo-1801338.jpg"" alt=""Caputo"" /></p>Así lo expresó el periodista de Editorial Perfil, Ariel Maciel, quien luego destacó: “Luis Caputo está intentando que el Fondo Monetario Internacional acceda a un nuevo acuerdo con Argentina”. <a href=""https://www.perfil.com/noticias/canal-e/el-gobierno-ya-quiere-poner-en-marcha-el-debate-de-un-nuevo-acuerdo-con-el-fondo-monetario-internacional.phtml"">Leer más</a>","Tue, 14 May 2024 14:03:51 GMT","Así lo expresó el periodista de Editorial Perfil, Ariel Maciel, quien luego destacó: “Luis Caputo está intentando que el Fondo Monetario Internacional acceda a un nuevo acuerdo con Argentina”.Leer más"
www.perfil.com,¿Qué tarjeta tenés? Todos los beneficios financieros para comprar en Hot Sale 2024 y hacer la diferencia,"<p><img src=""https://fotos.perfil.com/2022/05/31/trim/540/304/promos-hot-sale-20220531-1364625.jpg"" alt=""Promos Hot Sale 20220531"" /></p>El Hot Sale que se extiende hasta el 15 de mayo representa una fecha muy esperada por los consumidores. Los bancos y billeteras digitales se suman a la fecha con descuentos especiales, hasta 24 cuotas sin interés y beneficios acumulables.  <a href=""https://www.perfil.com/noticias/economia/que-tarjeta-tenes-todos-los-beneficios-financieros-para-comprar-en-hot-sale-2024-y-hacer-la-diferencia.phtml"">Leer más</a>","Tue, 14 May 2024 13:38:00 GMT","El Hot Sale que se extiende hasta el 15 de mayo representa una fecha muy esperada por los consumidores. Los bancos y billeteras digitales se suman a la fecha con descuentos especiales, hasta 24 cuotas sin interés y beneficios acumulables.Leer más"
www.perfil.com,Plazos Fijos: qué pasará con las tasas de interés en los próximos meses,"<p><img src=""https://fotos.perfil.com/2024/05/14/trim/540/304/banco-central-1801162.jpg"" alt=""Banco Central"" /></p>Después de reducir 3 veces en un mismo mes la tasa de interés de referencia, el Banco Central evalúa otra posible baja. <a href=""https://www.perfil.com/noticias/canal-e/plazos-fijos-que-pasara-con-las-tasas-de-interes-en-los-proximos-meses.phtml"">Leer más</a>","Tue, 14 May 2024 13:19:00 GMT","Después de reducir 3 veces en un mismo mes la tasa de interés de referencia, el Banco Central evalúa otra posible baja.Leer más"
